{
  "case_id": "sacgf-valor",
  "engine_commit": "33d8e6ff50bd1a59307c0356878b2393a441f5ef",
  "engine_source_sha256": "b8b32f376ce99da4e28accbef4ae8d860ec0b5f92e31a17baa07647415221587",
  "environment": {
    "architecture": "arm64",
    "dependencies": {
      "click": "8.4.2",
      "drawsvg": "2.4.1",
      "lark": "1.3.1",
      "networkx": "3.6.1",
      "pillow": "12.3.0"
    },
    "fonts": {
      "Inter-Bold.woff2": "a80d85ae8e8928616c8060f9488a18ce1fb3441d9a37ddf0be3346458eae1e91",
      "Inter-Regular.woff2": "9d661a08bc10d00ba1f886a8faf966b8a74bd66a6003a87590862cfeef41a1b8"
    },
    "locale": "C/C.UTF-8/C/C/C/C",
    "locale_environment": {
      "LANG": "C.UTF-8",
      "LC_ALL": "C.UTF-8",
      "LC_CTYPE": "C.UTF-8"
    },
    "os": "Darwin",
    "os_release": "25.5.0",
    "python": "3.11.15",
    "python_implementation": "CPython"
  },
  "hash_seed": 0,
  "machine_findings": {
    "bundle_discontinuity": {
      "count": 0,
      "count_rule": "sum of callable bundle-order and seam findings",
      "details": [],
      "severity": "error",
      "stage": "routing",
      "status": "passed"
    },
    "hanging_route": {
      "count": 0,
      "count_rule": "one per hanging-route finding",
      "details": [],
      "severity": "error",
      "stage": "routing",
      "status": "passed"
    },
    "label_strike": {
      "count": 0,
      "count_rule": "one per rendered label-strike finding",
      "details": [],
      "severity": "error",
      "stage": "rendered_artifact",
      "status": "passed"
    },
    "layout_crossings": {
      "count": 15,
      "count_rule": "one per layout-validator crossing finding",
      "details": [
        "route_segment_crossing: Lines 'fastq' (fastq_in->cat_fastq) and 'bam' (bam_in->samtools_merge) cross at (871,167) - not at a station, so the crossing is avoidable",
        "route_segment_crossing: Lines 'fastq' (cat_fastq->minimap2_align) and 'bam' (samtools_merge->samtools_sort_index) cross at (971,167) - not at a station, so the crossing is avoidable",
        "route_segment_crossing: Lines 'bam' (__junction_16->tr_calling__entry_right_9) and 'snvvcf' (__junction_17->cnv_calling__entry_right_10) cross at (1566,266) - not at a station, so the crossing is avoidable",
        "route_segment_crossing: Lines 'bam' (__junction_16->tr_calling__entry_right_9) and 'snvvcf' (__junction_17->jointcalling__entry_right_13) cross at (1566,266) - not at a station, so the crossing is avoidable",
        "route_segment_crossing: Lines 'bam' (__junction_16->tr_calling__entry_right_9) and 'snvvcf' (__junction_17->annotation__entry_right_14) cross at (1566,266) - not at a station, so the crossing is avoidable",
        "route_segment_crossing: Lines 'other' (__junction_16->cnv_calling__entry_right_10) and 'snvvcf' (__junction_17->jointcalling__entry_right_13) cross at (1552,282) - not at a station, so the crossing is avoidable",
        "route_segment_crossing: Lines 'other' (__junction_16->cnv_calling__entry_right_10) and 'snvvcf' (__junction_17->annotation__entry_right_14) cross at (1552,282) - not at a station, so the crossing is avoidable",
        "route_segment_crossing: Lines 'other' (__junction_16->cnv_calling__entry_right_10) and 'bam' (__junction_18->structural_variants__entry_right_15) cross at (1552,286) - not at a station, so the crossing is avoidable",
        "route_segment_crossing: Lines 'other' (__junction_16->cnv_calling__entry_right_10) and 'bam' (__junction_18->jointcalling__entry_right_13) cross at (1552,286) - not at a station, so the crossing is avoidable",
        "route_segment_crossing: Lines 'snvvcf' (__junction_17->cnv_calling__entry_right_10) and 'bam' (__junction_18->structural_variants__entry_right_15) cross at (1566,286) - not at a station, so the crossing is avoidable",
        "route_segment_crossing: Lines 'snvvcf' (__junction_17->cnv_calling__entry_right_10) and 'bam' (__junction_18->jointcalling__entry_right_13) cross at (1566,286) - not at a station, so the crossing is avoidable",
        "route_segment_crossing: Lines 'snvvcf' (__junction_17->jointcalling__entry_right_13) and 'svvcf' (__junction_19->jointcalling__entry_right_13) cross at (803,428) - not at a station, so the crossing is avoidable",
        "route_segment_crossing: Lines 'snvvcf' (__junction_17->annotation__entry_right_14) and 'svvcf' (__junction_19->annotation__entry_right_14) cross at (480,388) - not at a station, so the crossing is avoidable",
        "route_segment_crossing: Lines 'bam' (__junction_18->jointcalling__entry_right_13) and 'svvcf' (__junction_19->jointcalling__entry_right_13) cross at (807,428) - not at a station, so the crossing is avoidable",
        "route_segment_crossing: Lines 'svvcf' (__junction_19->annotation__entry_right_14) and 'snvvcf' (jointcalling__exit_left_7->annotation__entry_right_14) cross at (496,432) - not at a station, so the crossing is avoidable"
      ],
      "severity": "error",
      "stage": "routing",
      "status": "failed"
    },
    "marker_cross": {
      "count": 0,
      "count_rule": "one per rendered marker-cross finding",
      "details": [],
      "severity": "error",
      "stage": "rendered_artifact",
      "status": "passed"
    },
    "offset_collapse": {
      "count": 0,
      "count_rule": "one per rendered offset-collapse finding",
      "details": [],
      "severity": "error",
      "stage": "rendered_artifact",
      "status": "passed"
    },
    "reservation_violation": {
      "count": 0,
      "count_rule": "one per bypass-section-clearance finding",
      "details": [],
      "severity": "error",
      "stage": "routing",
      "status": "passed"
    },
    "route_through_section": {
      "count": 0,
      "count_rule": "one per edge-section-crossing finding",
      "details": [],
      "severity": "error",
      "stage": "routing",
      "status": "passed"
    },
    "strict_layout_guards": {
      "count": 0,
      "count_rule": "one per raised strict layout guard",
      "details": [],
      "severity": "error",
      "stage": "layout",
      "status": "passed"
    },
    "strict_routing_guards": {
      "count": 0,
      "count_rule": "one per raised strict routing guard",
      "details": [],
      "severity": "error",
      "stage": "routing",
      "status": "passed"
    }
  },
  "render_options": {
    "mode": null,
    "theme": null
  },
  "render_plan_sha256": "732785c518f17e181cc4e27e7c2718655ce42248ad8df990adf093d36867f797",
  "schema_version": 1,
  "settled_geometry_sha256": "af7e026f6070465e848f772756cca6863a591c2a1fd167b0500d41da4b09a389",
  "stages": {
    "layout": {
      "exception": null,
      "status": "passed"
    },
    "parse": {
      "exception": null,
      "status": "passed"
    },
    "render": {
      "exception": null,
      "status": "passed"
    },
    "resolution": {
      "exception": null,
      "status": "passed"
    },
    "routing": {
      "exception": null,
      "status": "passed"
    }
  },
  "svg": {
    "byte_length": 63621,
    "sha256": "8cd2bcf79b6ef64577c4280c0c8a664f5eaee28da1ae1b82d69fb014a59ac147"
  }
}
